{
  "schema_version": 4,
  "client": {
    "name": "chrome",
    "version": "150.0.7871.187",
    "engine": "chromium",
    "channel": "stable",
    "driver_version": "150.0.7871.124"
  },
  "environment": {
    "os": "windows-2025",
    "architecture": "AMD64",
    "headless": true,
    "runner_image": "win25-vs2026",
    "runner_image_version": "20260728.188.1"
  },
  "tls": {
    "trusted_by_browser": true,
    "alpn": "http/1.1",
    "secure_context": true
  },
  "scenario": {
    "id": "navigation-get",
    "method": "GET",
    "url": "https://http1.app.test:444/capture/navigation"
  },
  "request": {
    "raw_file": "raw/chrome/150.0.7871.187/windows-2025/http1/navigation-get.txt",
    "measurement_id": "4ec5b57d-a026-44d4-8c9c-0415bef11bbd",
    "http_version": "1.1",
    "protocol": "http1"
  },
  "observed_at": "2026-08-04T07:59:47.241Z"
}
