{
  "schema_version": 4,
  "client": {
    "name": "safari",
    "version": "26.5.2",
    "engine": "webkit",
    "channel": "stable",
    "driver_version": "Included with Safari 26.5.2 (20624.2.5.18.7)"
  },
  "environment": {
    "os": "macos-15",
    "architecture": "arm64",
    "headless": false,
    "runner_image": "macos15",
    "runner_image_version": "20260727.0256.1"
  },
  "tls": {
    "trusted_by_browser": true,
    "alpn": "http/1.1",
    "secure_context": true
  },
  "scenario": {
    "id": "form-post",
    "method": "POST",
    "url": "https://http1.app.test:444/capture/form"
  },
  "request": {
    "raw_file": "raw/safari/26.5.2/macos-15/http1/form-post.txt",
    "measurement_id": "f41fa0db-e0f3-46e7-815a-033f3a512d75",
    "http_version": "1.1",
    "protocol": "http1"
  },
  "observed_at": "2026-08-04T07:59:17.826Z"
}
