{
  "schema_version": 4,
  "client": {
    "name": "firefox",
    "version": "153.0.1",
    "engine": "gecko",
    "channel": "stable",
    "driver_version": "0.36.0"
  },
  "environment": {
    "os": "ubuntu-24.04",
    "architecture": "x86_64",
    "headless": true,
    "runner_image": "ubuntu24",
    "runner_image_version": "20260720.247.2"
  },
  "tls": {
    "trusted_by_browser": true,
    "alpn": "http/1.1",
    "secure_context": true
  },
  "scenario": {
    "id": "navigation-get",
    "method": "GET",
    "url": "https://http1.app.test:444/capture/navigation"
  },
  "request": {
    "raw_file": "raw/firefox/153.0.1/ubuntu-24.04/http1/navigation-get.txt",
    "measurement_id": "2303f205-ccee-4649-a64c-15c28de4de40",
    "http_version": "1.1",
    "protocol": "http1"
  },
  "observed_at": "2026-08-04T07:59:38.564Z"
}
