{
  "schema_version": 4,
  "client": {
    "name": "firefox",
    "version": "153.0.1",
    "engine": "gecko",
    "channel": "stable",
    "driver_version": "0.36.0"
  },
  "environment": {
    "os": "ubuntu-24.04",
    "architecture": "x86_64",
    "headless": true,
    "runner_image": "ubuntu24",
    "runner_image_version": "20260720.247.2"
  },
  "tls": {
    "trusted_by_browser": true,
    "alpn": "h2",
    "secure_context": true
  },
  "scenario": {
    "id": "form-post",
    "method": "POST",
    "url": "https://app.test/capture/form"
  },
  "request": {
    "raw_file": "raw/firefox/153.0.1/ubuntu-24.04/http2/form-post.txt",
    "measurement_id": "0f37e10b-18f3-4e3d-945f-775ffda6a5b6",
    "http_version": "2.0",
    "protocol": "http2"
  },
  "observed_at": "2026-08-04T07:59:38.431Z"
}
