{
  "schema_version": 4,
  "client": {
    "name": "edge",
    "version": "150.0.4078.99",
    "engine": "chromium",
    "channel": "stable",
    "driver_version": "Edge"
  },
  "environment": {
    "os": "windows-2025",
    "architecture": "AMD64",
    "headless": true,
    "runner_image": "win25-vs2026",
    "runner_image_version": "20260728.188.1"
  },
  "tls": {
    "trusted_by_browser": true,
    "alpn": "http/1.1",
    "secure_context": true
  },
  "scenario": {
    "id": "ajax-post",
    "method": "POST",
    "url": "https://http1.app.test:444/capture/ajax"
  },
  "request": {
    "raw_file": "raw/edge/150.0.4078.99/windows-2025/http1/ajax-post.txt",
    "measurement_id": "057ecbd3-ef5e-45d8-aac0-3080219f14b7",
    "http_version": "1.1",
    "protocol": "http1"
  },
  "observed_at": "2026-08-04T07:59:59.224Z"
}
