{
  "schema_version": 4,
  "client": {
    "name": "firefox",
    "version": "153.0.1",
    "engine": "gecko",
    "channel": "stable",
    "driver_version": "0.36.0"
  },
  "environment": {
    "os": "ubuntu-24.04",
    "architecture": "x86_64",
    "headless": true,
    "runner_image": "ubuntu24",
    "runner_image_version": "20260720.247.2"
  },
  "tls": {
    "trusted_by_browser": true,
    "alpn": "h2",
    "secure_context": true
  },
  "scenario": {
    "id": "navigation-get",
    "method": "GET",
    "url": "https://app.test/capture/navigation"
  },
  "request": {
    "raw_file": "raw/firefox/153.0.1/ubuntu-24.04/http2/navigation-get.txt",
    "measurement_id": "7f746838-682f-48fb-919e-6a7cd9d314dd",
    "http_version": "2.0",
    "protocol": "http2"
  },
  "observed_at": "2026-08-04T07:59:38.318Z"
}
