{
  "schema_version": 4,
  "client": {
    "name": "edge",
    "version": "150.0.4078.99",
    "engine": "chromium",
    "channel": "stable",
    "driver_version": "Edge"
  },
  "environment": {
    "os": "windows-2025",
    "architecture": "AMD64",
    "headless": true,
    "runner_image": "win25-vs2026",
    "runner_image_version": "20260728.188.1"
  },
  "tls": {
    "trusted_by_browser": true,
    "alpn": "h2",
    "secure_context": true
  },
  "scenario": {
    "id": "ajax-post",
    "method": "POST",
    "url": "https://app.test/capture/ajax"
  },
  "request": {
    "raw_file": "raw/edge/150.0.4078.99/windows-2025/http2/ajax-post.txt",
    "measurement_id": "23f03803-e8ae-4eb8-8516-176adc8e1b12",
    "http_version": "2.0",
    "protocol": "http2"
  },
  "observed_at": "2026-08-04T07:59:58.928Z"
}
