{
  "schema_version": 4,
  "client": {
    "name": "edge",
    "version": "150.0.4078.99",
    "engine": "chromium",
    "channel": "stable",
    "driver_version": "Edge"
  },
  "environment": {
    "os": "windows-2025",
    "architecture": "AMD64",
    "headless": true,
    "runner_image": "win25-vs2026",
    "runner_image_version": "20260728.188.1"
  },
  "tls": {
    "trusted_by_browser": true,
    "alpn": "h2",
    "secure_context": true
  },
  "scenario": {
    "id": "navigation-get",
    "method": "GET",
    "url": "https://app.test/capture/navigation"
  },
  "request": {
    "raw_file": "raw/edge/150.0.4078.99/windows-2025/http2/navigation-get.txt",
    "measurement_id": "8e6192ff-ce66-4a69-a6ca-1a755ddfe722",
    "http_version": "2.0",
    "protocol": "http2"
  },
  "observed_at": "2026-08-04T07:59:58.434Z"
}
