{
  "schema_version": 4,
  "client": {
    "name": "edge",
    "version": "150.0.4078.99",
    "engine": "chromium",
    "channel": "stable",
    "driver_version": "Edge"
  },
  "environment": {
    "os": "windows-2025",
    "architecture": "AMD64",
    "headless": true,
    "runner_image": "win25-vs2026",
    "runner_image_version": "20260728.188.1"
  },
  "tls": {
    "trusted_by_browser": true,
    "alpn": "http/1.1",
    "secure_context": true
  },
  "scenario": {
    "id": "navigation-get",
    "method": "GET",
    "url": "https://http1.app.test:444/capture/navigation"
  },
  "request": {
    "raw_file": "raw/edge/150.0.4078.99/windows-2025/http1/navigation-get.txt",
    "measurement_id": "0393675c-c469-44a9-a339-dd93812afdfd",
    "http_version": "1.1",
    "protocol": "http1"
  },
  "observed_at": "2026-08-04T07:59:59.001Z"
}
