{
  "schema_version": 4,
  "client": {
    "name": "chrome",
    "version": "150.0.7871.187",
    "engine": "chromium",
    "channel": "stable",
    "driver_version": "150.0.7871.124"
  },
  "environment": {
    "os": "windows-2025",
    "architecture": "AMD64",
    "headless": true,
    "runner_image": "win25-vs2026",
    "runner_image_version": "20260728.188.1"
  },
  "tls": {
    "trusted_by_browser": true,
    "alpn": "h2",
    "secure_context": true
  },
  "scenario": {
    "id": "navigation-get",
    "method": "GET",
    "url": "https://app.test/capture/navigation"
  },
  "request": {
    "raw_file": "raw/chrome/150.0.7871.187/windows-2025/http2/navigation-get.txt",
    "measurement_id": "53bd20bd-5e61-4634-9f41-3f170871a887",
    "http_version": "2.0",
    "protocol": "http2"
  },
  "observed_at": "2026-08-04T07:59:46.613Z"
}
